<?xml version="1.0" encoding="UTF-8"?>

    <sbm_eb:exampleBased xmlns="https://raw.github.com/pgunia/SemanticBuildingModeler_Ressources/master/Schema/ExampleBasedSynthesis"
        xmlns:xsi="http://www.w3.org/2001/XMLSchema-instance"
        xmlns:sbm_eb="https://raw.github.com/pgunia/SemanticBuildingModeler_Ressources/master/Schema/ExampleBasedSynthesis"
        xmlns:sbm_ct="https://raw.github.com/pgunia/SemanticBuildingModeler_Ressources/master/Schema/CommonTypes"
        xsi:schemaLocation="https://raw.github.com/pgunia/SemanticBuildingModeler_Ressources/master/Schema/ExampleBasedSynthesis https://raw.github.com/pgunia/SemanticBuildingModeler_Ressources/master/Schema/ExampleBasedSynthesis/ExampleBasedSynthesisSchema.xsd">
        <sbm_ct:polygonSource>
            <sbm_ct:file>
                <!-- git -->
                <sbm_ct:extern>https://raw.github.com/pgunia/SemanticBuildingModeler_Ressources/master/Models/SystemModels/Erkergrundriss.obj</sbm_ct:extern>
                <sbm_ct:fileFormat>OBJ</sbm_ct:fileFormat>
            </sbm_ct:file>
        </sbm_ct:polygonSource>
        <sbm_eb:firstComponentType>EDGE</sbm_eb:firstComponentType>
        <sbm_eb:cornerCount>1</sbm_eb:cornerCount>
        <sbm_eb:reflexCornerCount>1</sbm_eb:reflexCornerCount>
        <sbm_eb:edgeCount>-1</sbm_eb:edgeCount>
        <sbm_eb:insideCount>-1</sbm_eb:insideCount>
        <sbm_eb:outsideCount>-1</sbm_eb:outsideCount>
        <sbm_eb:randomComponentChoice>true</sbm_eb:randomComponentChoice>
        <sbm_eb:randomStateChoice>true</sbm_eb:randomStateChoice>
        <sbm_eb:consistencyConstraint>true</sbm_eb:consistencyConstraint>
        <sbm_eb:onlyRayComponents>false</sbm_eb:onlyRayComponents>
        <sbm_eb:onlyVertexComponents>false</sbm_eb:onlyVertexComponents>
        <sbm_eb:cornerVoteBoost>8</sbm_eb:cornerVoteBoost>
        <sbm_eb:reflexCornerVoteBoost>6</sbm_eb:reflexCornerVoteBoost>
        <sbm_eb:edgeVoteBoost>1</sbm_eb:edgeVoteBoost>
        <sbm_eb:outsideVoteBoost>1</sbm_eb:outsideVoteBoost>
        <sbm_eb:insideVoteBoost>1</sbm_eb:insideVoteBoost>
        <sbm_eb:numberOfParallelRays>8</sbm_eb:numberOfParallelRays>
        <sbm_eb:parallelRayDistance>157.23</sbm_eb:parallelRayDistance>
        <sbm_eb:parallelRayDistanceRuleComputation>17.93</sbm_eb:parallelRayDistanceRuleComputation>
        <sbm_eb:randomGrowth>false</sbm_eb:randomGrowth>
    </sbm_eb:exampleBased>

